<?xml version="1.0" encoding="ISO-8859-1"?>

<!DOCTYPE test-description SYSTEM "http://www.opencloud.com/dtd/slee-tck-test-description_1_0.dtd">

<test-description>

 <title>ProfileVerificationTest</title>
 <executeClass>com.opencloud.sleetck.lib.testsuite.profiles.profileverification.ProfileVerificationTest</executeClass>
    <assertion id="4343"/>
    <assertion id="1946"/>
    <assertion id="4365"/>
    <assertion id="4368"/>
 <property name="profileSpecDUPath" value="profiles.IndexedProfileSpec-du.jar"/>

</test-description>