<?xml version="1.0" encoding="ISO-8859-1"?>
 
<!DOCTYPE test-description SYSTEM "http://www.opencloud.com/dtd/slee-tck-test-description_1_0.dtd">
 
<test-description>
 <title>Test3932Test</title>
 <executeClass>com.opencloud.sleetck.lib.testsuite.javax.slee.management.SbbDescriptor.Test3932Test</executeClass>
 <assertion id="4759"/>
 <assertion id="3934"/>
 <assertion id="3936"/>
 <assertion id="3938"/>
 <property name="DUPath" value="javax.slee.management.SbbDescriptor.Test3932Service-du.jar"/>
</test-description>
