<?xml version="1.0" encoding="ISO-8859-1"?>
 
<!DOCTYPE test-description SYSTEM "http://www.opencloud.com/dtd/slee-tck-test-description_1_0.dtd">
 
<test-description>
 <title>Test2270Test</title>
 <executeClass>com.opencloud.sleetck.lib.testsuite.management.ServiceManagementMBean.Test2270Test</executeClass>
 <assertion id="2270"/>
 <assertion id="2271"/>
 <assertion id="2272"/>
 <assertion id="2473"/>
 <assertion id="2478"/>
 <property name="serviceDUPath" value="management.ServiceManagementMBean.Test2270Service-du.jar"/>
</test-description>
