<?xml version="1.0" encoding="ISO-8859-1"?>
 
<!DOCTYPE test-description SYSTEM "http://www.opencloud.com/dtd/slee-tck-test-description_1_0.dtd">
 
<test-description>
 <title>Test3701Test</title>
 <executeClass>com.opencloud.sleetck.lib.testsuite.javax.slee.facilities.TimerPreserveMissed.Test3701Test</executeClass>
 <assertion id="3701"/>
 <assertion id="3704"/>
 <assertion id="3706"/>
 <assertion id="3708"/>
 <assertion id="3710"/>
 <assertion id="3712"/>
 <assertion id="3714"/>
 <assertion id="3716"/>
 <property name="DUPath" value="javax.slee.facilities.TimerPreserveMissed.Test3701Service-du.jar"/>
</test-description>
