<?xml version="1.0" encoding="ISO-8859-1"?>
 
<!DOCTYPE test-description SYSTEM "http://www.opencloud.com/dtd/slee-tck-test-description_1_0.dtd">
 
<test-description>
 <title>Test4386Test</title>
 <executeClass>com.opencloud.sleetck.lib.testsuite.javax.slee.profile.ProfileRemovedEvent.Test4386Test</executeClass>
 <assertion id="4386"/>
 <assertion id="4389"/>
 <assertion id="4751"/>
 <assertion id="4752"/>
 <property name="DUPath" value="javax.slee.profile.ProfileRemovedEvent.Test4386Service-du.jar"/>
</test-description>
