<?xml version="1.0" encoding="ISO-8859-1"?>
 
<!DOCTYPE test-description SYSTEM "http://www.opencloud.com/dtd/slee-tck-test-description_1_0.dtd">
 
<test-description>
 
 <title>Test3333Test</title>
 <executeClass>com.opencloud.sleetck.lib.testsuite.javax.slee.Address.Test3333Test</executeClass>
 <assertion id="3333"/>
 <assertion id="3336"/>
 <assertion id="3338"/>
 <assertion id="3340"/>
 <assertion id="3342"/>
 <assertion id="3344"/>
 <assertion id="3346"/>
 <assertion id="3348"/>
 <assertion id="3350"/>
 <assertion id="3352"/>
</test-description>
